{
  "build_id": "build-pptsmith-v2-shared-builder-acceptance-20260719T065909Z",
  "builder": {
    "candidates": [
      {
        "available": true,
        "builder": "pptxgenjs",
        "editable_core_coverage": 1.0,
        "errors": [],
        "fallback_count": 0,
        "native_component_coverage": 1.0,
        "reasons": [
          "BUILDER_CANDIDATE_SCORED"
        ],
        "score": 0.775,
        "version": "4.0.1"
      }
    ],
    "errors": [],
    "requested": "pptxgenjs",
    "selected": "pptxgenjs",
    "selection_reasons": [
      "BUILDER_USER_REQUEST_VALID"
    ],
    "selection_score": 0.775,
    "version": "4.0.1",
    "warnings": []
  },
  "builder_profile": "pptxgenjs",
  "contract_refs": {
    "asset_manifest": "asset-manifest.json",
    "capability_report": "/private/tmp/pptsmith-task6.F1Rx5h/pptxgenjs/.ppt-work/contracts/capability-report.json",
    "delivery_plan": "/private/tmp/pptsmith-task6.F1Rx5h/pptxgenjs/.ppt-work/contracts/delivery-plan.json",
    "ppt_ir": "/private/tmp/pptsmith-task6.F1Rx5h/pptxgenjs/.ppt-work/contracts/ppt-ir.json",
    "production_profile": "production-profile.json",
    "qa_report": "../../qa/qa-report.json",
    "style_contract": "/private/tmp/pptsmith-task6.F1Rx5h/pptxgenjs/.ppt-work/contracts/style-contract.json"
  },
  "deck_id": "pptsmith-v2-shared-builder-acceptance",
  "environment": {
    "capability_report": "/private/tmp/pptsmith-task6.F1Rx5h/pptxgenjs/.ppt-work/contracts/capability-report.json"
  },
  "errors": [],
  "failed_stage": null,
  "fallbacks": [],
  "last_successful_stage": "verify",
  "metrics": {
    "average_object_count": 4.4444,
    "editable_core_ratio": 1.0,
    "fallback_count": 0,
    "logical_slide_count": 9,
    "media_count": 0,
    "native_chart_count": 1,
    "native_connector_count": 0,
    "native_table_count": 1,
    "native_text_ratio": 1.0,
    "object_count": 9,
    "physical_slide_count": 9,
    "qa_error_count": 0,
    "qa_fatal_count": 0,
    "qa_info_count": 0,
    "qa_warning_count": 11,
    "rasterized_area_ratio": 0.0,
    "render_success_ratio": null,
    "slide_count": 9,
    "whole_slide_raster_count": 0
  },
  "outputs": {
    "deck": "/private/tmp/pptsmith-task6.F1Rx5h/pptxgenjs/.ppt-work/builds/final/deck.pptx",
    "verification_report": "/private/tmp/pptsmith-task6.F1Rx5h/pptxgenjs/.ppt-work/builds/final/verification-report.md"
  },
  "production_profile_ref": null,
  "profile": "standard",
  "resume_from": null,
  "schema_version": "2.0",
  "stages": {
    "built": true,
    "planned": true,
    "qa_passed": true,
    "read_back": true,
    "rendered": false,
    "verified": true
  },
  "status": "verified",
  "warnings": [
    "Unsupported style field ignored by PptxGenJS runtime: description",
    "Unsupported style field ignored by PptxGenJS runtime: audience",
    "Unsupported style field ignored by PptxGenJS runtime: formality",
    "Unsupported style field ignored by PptxGenJS runtime: presentation_context",
    "Unsupported style field ignored by PptxGenJS runtime: colors.positive",
    "Unsupported style field ignored by PptxGenJS runtime: colors.warning",
    "Unsupported style field ignored by PptxGenJS runtime: colors.negative",
    "Unsupported style field ignored by PptxGenJS runtime: colors.allowed_opacity",
    "Unsupported style field ignored by PptxGenJS runtime: typography.font_mono",
    "Unsupported style field ignored by PptxGenJS runtime: typography.title_sizes_pt.cover",
    "Unsupported style field ignored by PptxGenJS runtime: typography.title_sizes_pt.section",
    "Unsupported style field ignored by PptxGenJS runtime: typography.body_sizes_pt.large",
    "Unsupported style field ignored by PptxGenJS runtime: typography.body_sizes_pt.footnote",
    "Unsupported style field ignored by PptxGenJS runtime: typography.metric_sizes_pt",
    "Unsupported style field ignored by PptxGenJS runtime: typography.minimum_body_size_pt",
    "Unsupported style field ignored by PptxGenJS runtime: typography.minimum_footnote_size_pt",
    "Unsupported style field ignored by PptxGenJS runtime: typography.line_height",
    "Unsupported style field ignored by PptxGenJS runtime: typography.paragraph_spacing_pt",
    "Unsupported style field ignored by PptxGenJS runtime: typography.letter_spacing_pt",
    "Unsupported style field ignored by PptxGenJS runtime: typography.weights",
    "Unsupported style field ignored by PptxGenJS runtime: grid.columns",
    "Unsupported style field ignored by PptxGenJS runtime: grid.rows",
    "Unsupported style field ignored by PptxGenJS runtime: grid.margin_bottom_in",
    "Unsupported style field ignored by PptxGenJS runtime: grid.gutter_vertical_in",
    "Unsupported style field ignored by PptxGenJS runtime: grid.footer_zone_height_in",
    "Unsupported style field ignored by PptxGenJS runtime: grid.safe_zone_in",
    "Unsupported style field ignored by PptxGenJS runtime: spacing.scale.xs",
    "Unsupported style field ignored by PptxGenJS runtime: spacing.scale.sm",
    "Unsupported style field ignored by PptxGenJS runtime: spacing.scale.xl",
    "Unsupported style field ignored by PptxGenJS runtime: spacing.scale.xxl",
    "Unsupported style field ignored by PptxGenJS runtime: spacing.rules.section_gap",
    "Unsupported style field ignored by PptxGenJS runtime: spacing.rules.icon_to_label",
    "Unsupported style field ignored by PptxGenJS runtime: spacing.rules.label_to_value",
    "Unsupported style field ignored by PptxGenJS runtime: spacing.rules.paragraph_gap",
    "Unsupported style field ignored by PptxGenJS runtime: shape_tokens",
    "Unsupported style field ignored by PptxGenJS runtime: shadow_tokens",
    "Unsupported style field ignored by PptxGenJS runtime: card_tokens",
    "Unsupported style field ignored by PptxGenJS runtime: table_tokens",
    "Unsupported style field ignored by PptxGenJS runtime: chart_tokens",
    "Unsupported style field ignored by PptxGenJS runtime: diagram_tokens",
    "Unsupported style field ignored by PptxGenJS runtime: image_tokens",
    "Unsupported style field ignored by PptxGenJS runtime: icon_tokens",
    "Unsupported style field ignored by PptxGenJS runtime: footer_tokens",
    "Unsupported style field ignored by PptxGenJS runtime: density_limits",
    "Unsupported style field ignored by PptxGenJS runtime: component_variants",
    "Unsupported style field ignored by PptxGenJS runtime: allowed_effects",
    "Unsupported style field ignored by PptxGenJS runtime: forbidden_drift",
    "Unsupported style field ignored by PptxGenJS runtime: compatibility_aliases"
  ]
}
